{
  "manifest_version": "pcs-v0.5",
  "artifacts": [
    "scope_packet.json",
    "scope_decision.json",
    "scope_grant.json",
    "pf_obligation.json"
  ],
  "hashes": {
    "scope_packet.json": "sha256:0000000000000000000000000000000000000000000000000000000000000001",
    "scope_decision.json": "sha256:0000000000000000000000000000000000000000000000000000000000000002",
    "scope_grant.json": "sha256:0000000000000000000000000000000000000000000000000000000000000003",
    "pf_obligation.json": "sha256:0000000000000000000000000000000000000000000000000000000000000004"
  },
  "source": {
    "akta_record_id": "AKTA-CONTRACT",
    "packet_id": "SCOPE-PKT-CONTRACT",
    "decision_id": "SCOPE-DEC-CONTRACT",
    "grant_id": "SCOPE-GRANT-CONTRACT"
  },
  "scope_trust_root_hash": "sha256:39a9d6fbfa046b6e066baa220ed1a7d42f1cb61aed6cd894dd4e06219819a8cc"
}
